{
  "theme": "base",
  "themeVariables": {
    "primaryColor": "#1E3A8A",
    "primaryTextColor": "#F8FAFC",
    "primaryBorderColor": "#172554",
    "secondaryColor": "#2563EB",
    "secondaryBorderColor": "#1E40AF",
    "tertiaryColor": "#BFDBFE",
    "tertiaryBorderColor": "#1E40AF",
    "background": "#F8FAFF",
    "backgroundVariables": "#F1F5F9",
    "backgroundOffset": "#E0F2FE",
    "clusterBkg": "#E0F2FE",
    "clusterBorder": "#1E3A8A",
    "lineColor": "#1E3A8A",
    "arrowheadColor": "#1E3A8A",
    "edgeLabelBackground": "#E2E8F0",
    "fontFamily": "Inter, 'Segoe UI', sans-serif",
    "fontSize": "16px",
    "titleColor": "#0F172A",
    "textColor": "#0F172A",
    "noteBkgColor": "#F8FAFF",
    "noteTextColor": "#0F172A",
    "noteBorderColor": "#1E40AF",
    "actorBorder": "#1E3A8A",
    "actorBkg": "#2563EB",
    "actorTextColor": "#F8FAFC",
    "actorLineColor": "#172554",
    "sequenceNumberColor": "#1E3A8A",
    "labelBoxBkgColor": "#E0F2FE",
    "labelBoxBorderColor": "#1E3A8A",
    "labelTextColor": "#0F172A",
    "cScale0": "#0F172A",
    "cScale1": "#1E3A8A",
    "cScale2": "#1D4ED8",
    "cScale3": "#2563EB",
    "cScale4": "#3B82F6",
    "cScale5": "#60A5FA",
    "cScale6": "#93C5FD",
    "cScale7": "#BFDBFE",
    "quadrant1Fill": "#1E3A8A",
    "quadrant2Fill": "#3B82F6",
    "quadrant3Fill": "#172554",
    "quadrant4Fill": "#60A5FA",
    "quadrant1TextFill": "#F8FAFC",
    "quadrant2TextFill": "#F8FAFC",
    "quadrant3TextFill": "#F8FAFC",
    "quadrant4TextFill": "#0F172A",
    "pieTitleTextSize": "20px",
    "pieSectionTextSize": "14px",
    "pieSectionTextColor": "#0F172A",
    "pieStrokeColor": "#1E3A8A",
    "pieStrokeWidth": "2px",
    "mindmapBranchColor": "#1E3A8A",
    "mindmapLeafColor": "#3B82F6"
  },
  "themeCSS": "\n  :root {\n    --kv-blue-950: #0B1220;\n    --kv-blue-900: #0F172A;\n    --kv-blue-800: #1E3A8A;\n    --kv-blue-700: #1D4ED8;\n    --kv-blue-600: #2563EB;\n    --kv-blue-500: #3B82F6;\n    --kv-blue-400: #60A5FA;\n    --kv-blue-300: #93C5FD;\n    --kv-blue-200: #BFDBFE;\n    --kv-ice-100: #E0F2FE;\n    --kv-ice-50: #F8FAFF;\n  }\n\n  body {\n    font-family: \"Inter\", \"Segoe UI\", sans-serif;\n    color: var(--kv-blue-900);\n  }\n\n  .node rect, .node circle, .node polygon {\n    rx: 8px;\n    ry: 8px;\n    stroke-width: 2px;\n  }\n\n  .node text, .label text, .sectionTitle {\n    fill: var(--kv-blue-900);\n    font-weight: 600;\n  }\n\n  .edgeLabel text {\n    fill: var(--kv-blue-900);\n    font-weight: 600;\n  }\n\n  .edgeLabel rect {\n    fill: var(--kv-ice-100);\n    stroke: var(--kv-blue-700);\n    stroke-width: 1.5px;\n    rx: 6px;\n    ry: 6px;\n  }\n\n  .edgePath path, .flowchart-link path {\n    stroke: var(--kv-blue-700);\n    stroke-width: 2px;\n  }\n\n  .marker path {\n    fill: var(--kv-blue-700);\n  }\n\n  .cluster rect {\n    fill: var(--kv-ice-100);\n    stroke: var(--kv-blue-800);\n    stroke-width: 2px;\n    rx: 12px;\n    ry: 12px;\n  }\n\n  .kv-primary rect, .kv-primary circle, .kv-primary polygon {\n    fill: var(--kv-blue-800) !important;\n    stroke: var(--kv-blue-950) !important;\n    stroke-width: 2.5px !important;\n  }\n\n  .kv-primary text {\n    fill: #F8FAFC !important;\n  }\n\n  .kv-accent rect, .kv-accent circle, .kv-accent polygon {\n    fill: var(--kv-blue-600) !important;\n    stroke: var(--kv-blue-900) !important;\n    stroke-width: 2.5px !important;\n  }\n\n  .kv-accent text {\n    fill: #F8FAFC !important;\n  }\n\n  .kv-highlight rect, .kv-highlight circle, .kv-highlight polygon {\n    fill: var(--kv-blue-400) !important;\n    stroke: var(--kv-blue-700) !important;\n    stroke-width: 2.5px !important;\n  }\n\n  .kv-highlight text {\n    fill: var(--kv-blue-900) !important;\n  }\n\n  .kv-muted rect, .kv-muted circle, .kv-muted polygon {\n    fill: var(--kv-ice-100) !important;\n    stroke: var(--kv-blue-700) !important;\n    stroke-width: 2.5px !important;\n    stroke-dasharray: 8 4 !important;\n  }\n\n  .kv-muted text {\n    fill: var(--kv-blue-900) !important;\n  }\n\n  .kv-pattern rect, .kv-pattern circle, .kv-pattern polygon {\n    fill: var(--kv-blue-300) !important;\n    stroke: var(--kv-blue-900) !important;\n    stroke-width: 2.5px !important;\n    stroke-dasharray: 4 3 !important;\n    stroke-linecap: round !important;\n  }\n\n  .kv-pattern text {\n    fill: var(--kv-blue-950) !important;\n  }\n\n  .kv-outline rect, .kv-outline circle, .kv-outline polygon {\n    fill: #FFFFFF !important;\n    stroke: var(--kv-blue-800) !important;\n    stroke-width: 3px !important;\n  }\n\n  .kv-outline text {\n    fill: #0F172A !important;\n    font-weight: 700 !important;\n  }\n\n  .kv-elevated rect, .kv-elevated circle, .kv-elevated polygon {\n    fill: var(--kv-ice-50) !important;\n    stroke: var(--kv-blue-700) !important;\n    stroke-width: 2px !important;\n    filter: drop-shadow(0 2px 4px rgba(15, 23, 42, 0.15));\n  }\n\n  .kv-elevated text {\n    fill: var(--kv-blue-900) !important;\n  }\n\n  .mindmap-node circle, .mindmap-node rect {\n    stroke: var(--kv-blue-800) !important;\n    stroke-width: 2px !important;\n  }\n\n  .mindmap-node.leaf > rect, .mindmap-node.leaf > circle {\n    fill: var(--kv-blue-400) !important;\n  }\n\n  .mindmap-node.leaf text {\n    fill: #FFFFFF !important;\n  }\n\n  .mindmap-node.level-1 > rect, .mindmap-node.level-1 > circle {\n    fill: var(--kv-blue-800) !important;\n  }\n\n  .mindmap-node.level-1 text {\n    fill: #F8FAFC !important;\n  }\n\n  .mindmap-node.level-2 > rect, .mindmap-node.level-2 > circle {\n    fill: var(--kv-blue-500) !important;\n  }\n\n  .mindmap-node.level-2 text {\n    fill: #F8FAFC !important;\n  }\n\n  .sequenceMessageLine0, .sequenceMessageLine1, .sequenceMessageLine2 {\n    stroke: var(--kv-blue-700) !important;\n  }\n\n  .sequenceNumber {\n    fill: #FFFFFF !important;\n    stroke: var(--kv-blue-800) !important;\n    stroke-width: 2px !important;\n  }\n\n  .sequenceLabelBox {\n    fill: var(--kv-ice-100) !important;\n    stroke: var(--kv-blue-700) !important;\n  }\n\n  .actor {\n    fill: var(--kv-blue-500) !important;\n    stroke: var(--kv-blue-900) !important;\n    color: #F8FAFC !important;\n  }\n\n  .actor text {\n    fill: #F8FAFC !important;\n  }\n\n  .kv-legend rect {\n    fill: #FFFFFF !important;\n    stroke: var(--kv-blue-700) !important;\n    stroke-width: 1.5px !important;\n    rx: 8px;\n    ry: 8px;\n  }\n\n  .kv-legend text {\n    fill: var(--kv-blue-900) !important;\n    font-size: 14px;\n  }\n\n  .quadrant rect {\n    stroke-width: 0px !important;\n  }\n\n  .pieOuterCircle {\n    stroke: var(--kv-blue-800) !important;\n    stroke-width: 2px !important;\n  }\n"
}
